{
  "$schema": "https://json-schema.org/draft/2020-12/schema",
  "$id": "https://schemas.ardyn.ai/boundary-maps/ardyn.phase-5.26.review-artifact-evaluator-input-handoff.schema.json",
  "title": "ARDYN Boundary Map: ardyn.phase-5.26.review-artifact-evaluator-input-handoff",
  "description": "Auto-generated JSON Schema for boundary-map artifact validation. Enforces shape + safety invariants.",
  "type": "object",
  "required": [
    "schema",
    "schemaVersion",
    "phase",
    "artifactKind",
    "metadataGeneratedAt",
    "sourcePhase",
    "handoffSummary",
    "handoffInputShape",
    "handoffResultShape",
    "handoffCases",
    "evaluatorInputCandidateBoundary",
    "blockedRuntimeEffect",
    "serveRuntimeBlockedBehavior",
    "forbiddenBehavior",
    "filesAllowedToChange",
    "filesForbiddenToChange",
    "validationCommands"
  ],
  "properties": {
    "schema": {
      "type": "string",
      "const": "ardyn.phase-5.26.review-artifact-evaluator-input-handoff"
    },
    "schemaVersion": {
      "type": "string"
    },
    "phase": {
      "type": "string"
    },
    "artifactKind": {
      "type": "string"
    },
    "metadataGeneratedAt": {
      "type": "string"
    },
    "sourcePhase": {
      "type": "object"
    },
    "handoffSummary": {
      "type": "object"
    },
    "handoffInputShape": {
      "type": "object"
    },
    "handoffResultShape": {
      "type": "object"
    },
    "handoffCases": {
      "type": "array"
    },
    "evaluatorInputCandidateBoundary": {
      "type": "object"
    },
    "blockedRuntimeEffect": {
      "type": "object"
    },
    "serveRuntimeBlockedBehavior": {
      "type": "object"
    },
    "forbiddenBehavior": {
      "type": "object"
    },
    "filesAllowedToChange": {
      "type": "array"
    },
    "filesForbiddenToChange": {
      "type": "array"
    },
    "validationCommands": {
      "type": "array"
    }
  },
  "additionalProperties": true
}
