{
  "schema": "ardyn.phase-5.26.review-artifact-evaluator-input-handoff",
  "schemaVersion": "0.1.0",
  "phase": "phase-5.26-review-artifact-evaluator-input-handoff",
  "artifactKind": "review-artifact-evaluator-input-handoff",
  "metadataGeneratedAt": "1970-01-01T00:00:00.000Z",
  "sourcePhase": {
    "phase": "phase-5.25-non-authorizing-review-artifact-boundary",
    "reviewArtifactBoundaryPath": "packages/core/src/index.mjs#createPrerequisiteReviewArtifactBoundaryForReview",
    "evaluatorInputHandoffPath": "packages/core/src/index.mjs#createReviewArtifactEvaluatorInputHandoffForReview",
    "sourceReviewArtifactFixture": "tests/fixtures/host-policy/phase5-25/non-authorizing-review-artifact-boundary.json",
    "runtimeEnabled": false,
    "approvalGrantProduced": false
  },
  "handoffSummary": {
    "handoffRecorded": true,
    "handoffKind": "review-artifact-evaluator-input-handoff",
    "handoffReviewOnly": true,
    "handoffAuthoritative": false,
    "validReviewArtifactsProduceEvaluatorInputCandidate": true,
    "missingReviewArtifactsRejected": true,
    "malformedReviewArtifactsRejected": true,
    "emptyReviewArtifactsRejected": true,
    "conflictingReviewArtifactsRejected": true,
    "staleReviewArtifactsRejected": true,
    "revokedReviewArtifactsRejected": true,
    "unknownReviewArtifactsRejected": true,
    "duplicateInvalidReviewArtifactsRejected": true,
    "authorizingLookingReviewArtifactsRejected": true,
    "evaluatorInputCandidateIsApprovalGrant": false,
    "approvalGrantProduced": false,
    "approvalGrantPersisted": false,
    "runtimePermissionGranted": false,
    "commandExposurePermissionGranted": false,
    "runtimeEnabled": false,
    "runtimeCommandEnabled": false,
    "runtimeCommandExposureEnabled": false,
    "runtimeExecutionEnabled": false,
    "serveRuntimeStillDefaultBlocked": true,
    "dryRunBypassesBlock": false,
    "canEnableRuntime": false
  },
  "handoffInputShape": {
    "reviewArtifactsRequired": true,
    "reviewArtifactSchema": "ardyn.phase-5.25.non-authorizing-prerequisite-review-artifact",
    "reviewArtifactMode": "review-only",
    "sourceReviewArtifactRequired": true,
    "validReviewArtifactRequired": true,
    "authorizingLookingArtifactPolicy": "fail-closed",
    "conflictingInputPolicy": "fail-closed",
    "duplicateInvalidInputPolicy": "fail-closed",
    "filesystemWatcherAllowed": false,
    "externalSourceLookupAllowed": false,
    "secretsEnvIngestionAllowed": false,
    "filePathAllowed": false,
    "urlAllowed": false
  },
  "handoffResultShape": {
    "schema": "ardyn.phase-5.26.prerequisite-review-artifact-evaluator-input-handoff-result",
    "schemaVersion": "0.1.0",
    "handoffKind": "review-artifact-evaluator-input-handoff",
    "handoffMode": "review-only",
    "reviewOnly": true,
    "authoritative": false,
    "validReviewArtifactsMayProduceEvaluatorInputCandidate": true,
    "evaluatorInputCandidateSchema": "ardyn.phase-5.26.review-artifact-evaluator-input-candidate",
    "evaluatorInputCandidateIsApprovalGrant": false,
    "approvalGrantProduced": false,
    "approvalGrantPersisted": false,
    "runtimePermissionGranted": false,
    "commandExposurePermissionGranted": false,
    "runtimeEffectAllFalse": true
  },
  "handoffCases": [
    {
      "caseId": "missing-review-artifact-handoff-input-rejected",
      "classification": "missing_review_artifact_evaluator_input_handoff_rejected",
      "evaluatorInputCandidateProduced": false,
      "evaluatorInputCandidateIsApprovalGrant": false,
      "reviewOnly": true,
      "authoritative": false,
      "approvalGrant": {
        "produced": false,
        "persisted": false,
        "grantId": null
      },
      "runtimePermissionGranted": false,
      "commandExposurePermissionGranted": false,
      "runtimeEffect": {
        "runtimeEnabled": false,
        "runtimeStarted": false,
        "runtimeReady": false,
        "runtimeCommandEnabled": false,
        "runtimeCommandExposureEnabled": false,
        "runtimeExecutionEnabled": false,
        "runtimeExecuted": false,
        "approvalGrantProduced": false,
        "approvalGrantPersisted": false,
        "approvalEvaluatorAuthoritative": false
      }
    },
    {
      "caseId": "malformed-review-artifact-handoff-input-rejected",
      "classification": "malformed_review_artifact_evaluator_input_handoff_rejected",
      "evaluatorInputCandidateProduced": false,
      "evaluatorInputCandidateIsApprovalGrant": false,
      "reviewOnly": true,
      "authoritative": false,
      "approvalGrant": {
        "produced": false,
        "persisted": false,
        "grantId": null
      },
      "runtimePermissionGranted": false,
      "commandExposurePermissionGranted": false,
      "runtimeEffect": {
        "runtimeEnabled": false,
        "runtimeStarted": false,
        "runtimeReady": false,
        "runtimeCommandEnabled": false,
        "runtimeCommandExposureEnabled": false,
        "runtimeExecutionEnabled": false,
        "runtimeExecuted": false,
        "approvalGrantProduced": false,
        "approvalGrantPersisted": false,
        "approvalEvaluatorAuthoritative": false
      }
    },
    {
      "caseId": "malformed-review-artifact-invalid-reviewed-at-rejected",
      "classification": "malformed_review_artifact_evaluator_input_handoff_rejected",
      "evaluatorInputCandidateProduced": false,
      "evaluatorInputCandidateIsApprovalGrant": false,
      "reviewOnly": true,
      "authoritative": false,
      "approvalGrant": {
        "produced": false,
        "persisted": false,
        "grantId": null
      },
      "runtimePermissionGranted": false,
      "commandExposurePermissionGranted": false,
      "runtimeEffect": {
        "runtimeEnabled": false,
        "runtimeStarted": false,
        "runtimeReady": false,
        "runtimeCommandEnabled": false,
        "runtimeCommandExposureEnabled": false,
        "runtimeExecutionEnabled": false,
        "runtimeExecuted": false,
        "approvalGrantProduced": false,
        "approvalGrantPersisted": false,
        "approvalEvaluatorAuthoritative": false
      }
    },
    {
      "caseId": "empty-review-artifact-handoff-input-rejected",
      "classification": "empty_review_artifact_evaluator_input_handoff_rejected",
      "evaluatorInputCandidateProduced": false,
      "evaluatorInputCandidateIsApprovalGrant": false,
      "reviewOnly": true,
      "authoritative": false,
      "approvalGrant": {
        "produced": false,
        "persisted": false,
        "grantId": null
      },
      "runtimePermissionGranted": false,
      "commandExposurePermissionGranted": false,
      "runtimeEffect": {
        "runtimeEnabled": false,
        "runtimeStarted": false,
        "runtimeReady": false,
        "runtimeCommandEnabled": false,
        "runtimeCommandExposureEnabled": false,
        "runtimeExecutionEnabled": false,
        "runtimeExecuted": false,
        "approvalGrantProduced": false,
        "approvalGrantPersisted": false,
        "approvalEvaluatorAuthoritative": false
      }
    },
    {
      "caseId": "conflicting-review-artifact-handoff-input-rejected",
      "classification": "conflicting_review_artifact_evaluator_input_handoff_rejected",
      "evaluatorInputCandidateProduced": false,
      "evaluatorInputCandidateIsApprovalGrant": false,
      "reviewOnly": true,
      "authoritative": false,
      "approvalGrant": {
        "produced": false,
        "persisted": false,
        "grantId": null
      },
      "runtimePermissionGranted": false,
      "commandExposurePermissionGranted": false,
      "runtimeEffect": {
        "runtimeEnabled": false,
        "runtimeStarted": false,
        "runtimeReady": false,
        "runtimeCommandEnabled": false,
        "runtimeCommandExposureEnabled": false,
        "runtimeExecutionEnabled": false,
        "runtimeExecuted": false,
        "approvalGrantProduced": false,
        "approvalGrantPersisted": false,
        "approvalEvaluatorAuthoritative": false
      }
    },
    {
      "caseId": "stale-review-artifact-handoff-input-rejected",
      "classification": "stale_review_artifact_evaluator_input_handoff_rejected",
      "evaluatorInputCandidateProduced": false,
      "evaluatorInputCandidateIsApprovalGrant": false,
      "reviewOnly": true,
      "authoritative": false,
      "approvalGrant": {
        "produced": false,
        "persisted": false,
        "grantId": null
      },
      "runtimePermissionGranted": false,
      "commandExposurePermissionGranted": false,
      "runtimeEffect": {
        "runtimeEnabled": false,
        "runtimeStarted": false,
        "runtimeReady": false,
        "runtimeCommandEnabled": false,
        "runtimeCommandExposureEnabled": false,
        "runtimeExecutionEnabled": false,
        "runtimeExecuted": false,
        "approvalGrantProduced": false,
        "approvalGrantPersisted": false,
        "approvalEvaluatorAuthoritative": false
      }
    },
    {
      "caseId": "revoked-review-artifact-handoff-input-rejected",
      "classification": "revoked_review_artifact_evaluator_input_handoff_rejected",
      "evaluatorInputCandidateProduced": false,
      "evaluatorInputCandidateIsApprovalGrant": false,
      "reviewOnly": true,
      "authoritative": false,
      "approvalGrant": {
        "produced": false,
        "persisted": false,
        "grantId": null
      },
      "runtimePermissionGranted": false,
      "commandExposurePermissionGranted": false,
      "runtimeEffect": {
        "runtimeEnabled": false,
        "runtimeStarted": false,
        "runtimeReady": false,
        "runtimeCommandEnabled": false,
        "runtimeCommandExposureEnabled": false,
        "runtimeExecutionEnabled": false,
        "runtimeExecuted": false,
        "approvalGrantProduced": false,
        "approvalGrantPersisted": false,
        "approvalEvaluatorAuthoritative": false
      }
    },
    {
      "caseId": "unknown-review-artifact-handoff-input-rejected",